{
  "schemaVersion": 1,
  "name": "default",
  "description": "Baseline profile: the three core agents (sr-architect, sr-developer, sr-reviewer) with the models matching their shipped frontmatters. Extend by adding user-owned custom-* agents and routing rules.",
  "orchestrator": { "model": "sonnet" },
  "agents": [
    { "id": "sr-architect", "model": "sonnet", "required": true },
    { "id": "sr-developer", "model": "sonnet", "required": true },
    { "id": "sr-reviewer",  "model": "sonnet", "required": true }
  ],
  "routing": [
    { "default": true, "agent": "sr-developer" }
  ]
}
